Reinhausen 39/Abri Immengrund I,Germany,Niedersachsen,51.457778,10.008889,"NO-Profil, Layer 9",10 - 20,15,1,NA,NA,NA,NA,NA,NA,NA,NA,NA,NA,230,NA,NA,NE,1,Metal Ages only,1,NA,NA,1,NA,NA,NA,NA,NA,NA,NA,"Grote, Klaus. “Die Buntsandsteinabris im südniedersächsischen Bergland bei Göttingen. Erfassung und Untersuchung ihrer ur- und frühgeschichtlichen Nutzung (1983 - 1987)”. Die Kunde N.F. 39 (1988): 1–43.","Grote, Klaus. “Das Buntsandsteinabri Bettenroder Berg IX im Reinhäuser Wald bei Göttingen - Paläolithikum und Mesolithikum”. Archäologisches Korrespondenzblatt 20 (1990): 137–47.","Grote, Klaus. Die Abris im südlichen Leinebergland bei Göttingen. Archäologische Befunde zum Leben unter Felsschutzdächern in urgeschichtlicher Zeit. Oldenburg: Isensee Verlag, 1994.","Grote, Klaus. “Archäologische Landesaufnahme im Gebiet des Seeburger Sees, Luttersees und ehemaligen Westersees im Untereichsfeld, Ldkr. Göttingen”. Neue Ausgrabungen und Forschungen in Niedersachsen 21 (1999): 13–136.","Ahl, C., og B. Meyer. “Zur bodenkundlich-sedimentologischen Horizontabfolge der Hauptabris im Buntsandsteingebiet von Reinhausen”. I Die Abris im südlichen Leinebergland bei Göttingen. Archäologische Befunde zum Leben unter Felsschutzdächern in urgeschichtlicher Zeit, redigeret af Klaus Grote, 2:37–52. Oldenburg: Isensee Verlag, 1994.",NA,NA,NA,NA,482
Schünebusch,Germany,Niedersachsen,52.586944,9.013611,Profile I-IV,10 - 60,35,NA,NA,NA,NA,NA,NA,NA,NA,NA,NA,NA,270,31,NA,NE,1,NA,NA,NA,1,NA,1,NA,NA,NA,NA,NA,NA,"Caspers, Gerfried. “Fluviatile Geomorphodynamik und Vegetationsentwicklung im Tal der Weser seit dem Spätglazial”. Berichte der Naturhistorischen Gesellschaft Hannover 135 (1993): 29–48.","Caspers, Gerfried. “Vegetationskundliche Untersuchungen zur Flussauenentwicklung an der Mittelweser im Spätglazial und Holozän”. Abhandlungen aus dem Westfälischen Museum für Naturkunde 55, nr. 1 (1993): 1–101.","Lipps, S., og Gerfried Caspers. “Spätglazial und Holozän auf der Stolzenauer Terrasse im Mittelwesertal”. Eiszeitalter & Gegenwart 40 (1990): 111–19.",NA,NA,NA,Update 5,NA,NA,483
Reinhausen/Abri Lustal II,Germany,Niedersachsen,51.457778,10.008889,"N-Profil, Layer 5",15 - 20,17.5,1,NA,NA,NA,NA,NA,NA,NA,NA,NA,NA,230,NA,NA,NE,1,NA,1,NA,NA,1,NA,NA,NA,NA,NA,NA,NA,"Grote, Klaus. “Die Buntsandsteinabris im südniedersächsischen Bergland bei Göttingen. Erfassung und Untersuchung ihrer ur- und frühgeschichtlichen Nutzung (1983 - 1987)”. Die Kunde N.F. 39 (1988): 1–43.","Grote, Klaus. “Das Buntsandsteinabri Bettenroder Berg IX im Reinhäuser Wald bei Göttingen - Paläolithikum und Mesolithikum”. Archäologisches Korrespondenzblatt 20 (1990): 137–47.","Grote, Klaus. Die Abris im südlichen Leinebergland bei Göttingen. Archäologische Befunde zum Leben unter Felsschutzdächern in urgeschichtlicher Zeit. Oldenburg: Isensee Verlag, 1994.","Grote, Klaus. “Archäologische Landesaufnahme im Gebiet des Seeburger Sees, Luttersees und ehemaligen Westersees im Untereichsfeld, Ldkr. Göttingen”. Neue Ausgrabungen und Forschungen in Niedersachsen 21 (1999): 13–136.","Ahl, C., og B. Meyer. “Zur bodenkundlich-sedimentologischen Horizontabfolge der Hauptabris im Buntsandsteingebiet von Reinhausen”. I Die Abris im südlichen Leinebergland bei Göttingen. Archäologische Befunde zum Leben unter Felsschutzdächern in urgeschichtlicher Zeit, redigeret af Klaus Grote, 2:37–52. Oldenburg: Isensee Verlag, 1994.",NA,NA,NA,NA,484
Reinhausen 36/Abri Bettenroder Berg XI,Germany,Niedersachsen,51.457778,10.008889,"W-Profil, Layer 5",20 - 25,22.5,1,NA,NA,NA,NA,NA,NA,NA,NA,NA,NA,230,NA,NA,NE,1,Mesolithic (and later) only,1,NA,NA,1,NA,NA,NA,NA,NA,NA,NA,"Grote, Klaus. “Die Buntsandsteinabris im südniedersächsischen Bergland bei Göttingen. Erfassung und Untersuchung ihrer ur- und frühgeschichtlichen Nutzung (1983 - 1987)”. Die Kunde N.F. 39 (1988): 1–43.","Grote, Klaus. “Das Buntsandsteinabri Bettenroder Berg IX im Reinhäuser Wald bei Göttingen - Paläolithikum und Mesolithikum”. Archäologisches Korrespondenzblatt 20 (1990): 137–47.","Grote, Klaus. Die Abris im südlichen Leinebergland bei Göttingen. Archäologische Befunde zum Leben unter Felsschutzdächern in urgeschichtlicher Zeit. Oldenburg: Isensee Verlag, 1994.","Grote, Klaus. “Archäologische Landesaufnahme im Gebiet des Seeburger Sees, Luttersees und ehemaligen Westersees im Untereichsfeld, Ldkr. Göttingen”. Neue Ausgrabungen und Forschungen in Niedersachsen 21 (1999): 13–136.","Ahl, C., og B. Meyer. “Zur bodenkundlich-sedimentologischen Horizontabfolge der Hauptabris im Buntsandsteingebiet von Reinhausen”. I Die Abris im südlichen Leinebergland bei Göttingen. Archäologische Befunde zum Leben unter Felsschutzdächern in urgeschichtlicher Zeit, redigeret af Klaus Grote, 2:37–52. Oldenburg: Isensee Verlag, 1994.",NA,NA,NA,NA,485
Gross Schneen 38/Abri Stendel XVIII,Germany,Niedersachsen,51.443839,9.96707,"W-, N- and E-Profil, Layer 20",20 - 30,25,1,NA,NA,NA,NA,NA,NA,NA,NA,NA,NA,230,NA,NA,NE,1,NA,1,NA,NA,1,NA,NA,NA,NA,NA,NA,NA,"Grote, Klaus. “Die Buntsandsteinabris im südniedersächsischen Bergland bei Göttingen. Erfassung und Untersuchung ihrer ur- und frühgeschichtlichen Nutzung (1983 - 1987)”. Die Kunde N.F. 39 (1988): 1–43.","Grote, Klaus. “Das Buntsandsteinabri Bettenroder Berg IX im Reinhäuser Wald bei Göttingen - Paläolithikum und Mesolithikum”. Archäologisches Korrespondenzblatt 20 (1990): 137–47.","Grote, Klaus. Die Abris im südlichen Leinebergland bei Göttingen. Archäologische Befunde zum Leben unter Felsschutzdächern in urgeschichtlicher Zeit. Oldenburg: Isensee Verlag, 1994.","Grote, Klaus. “Archäologische Landesaufnahme im Gebiet des Seeburger Sees, Luttersees und ehemaligen Westersees im Untereichsfeld, Ldkr. Göttingen”. Neue Ausgrabungen und Forschungen in Niedersachsen 21 (1999): 13–136.","Ahl, C., og B. Meyer. “Zur bodenkundlich-sedimentologischen Horizontabfolge der Hauptabris im Buntsandsteingebiet von Reinhausen”. I Die Abris im südlichen Leinebergland bei Göttingen. Archäologische Befunde zum Leben unter Felsschutzdächern in urgeschichtlicher Zeit, redigeret af Klaus Grote, 2:37–52. Oldenburg: Isensee Verlag, 1994.",NA,NA,NA,NA,486
Bettenroder Berg I,Germany,Niedersachsen,51.457778,10.008889,"S- and N-Profil, Layer VI",20 - 90,55,1,NA,NA,NA,NA,NA,NA,NA,NA,NA,NA,230,NA,NA,NE,1,Federmessergruppen below,1,NA,1,1,NA,NA,NA,NA,Yes,NA,NA,"Grote, Klaus. “Die Buntsandsteinabris im südniedersächsischen Bergland bei Göttingen. Erfassung und Untersuchung ihrer ur- und frühgeschichtlichen Nutzung (1983 - 1987)”. Die Kunde N.F. 39 (1988): 1–43.","Grote, Klaus. “Das Buntsandsteinabri Bettenroder Berg IX im Reinhäuser Wald bei Göttingen - Paläolithikum und Mesolithikum”. Archäologisches Korrespondenzblatt 20 (1990): 137–47.","Grote, Klaus. Die Abris im südlichen Leinebergland bei Göttingen. Archäologische Befunde zum Leben unter Felsschutzdächern in urgeschichtlicher Zeit. Oldenburg: Isensee Verlag, 1994.","Grote, Klaus. “Archäologische Landesaufnahme im Gebiet des Seeburger Sees, Luttersees und ehemaligen Westersees im Untereichsfeld, Ldkr. Göttingen”. Neue Ausgrabungen und Forschungen in Niedersachsen 21 (1999): 13–136.","Ahl, C., og B. Meyer. “Zur bodenkundlich-sedimentologischen Horizontabfolge der Hauptabris im Buntsandsteingebiet von Reinhausen”. I Die Abris im südlichen Leinebergland bei Göttingen. Archäologische Befunde zum Leben unter Felsschutzdächern in urgeschichtlicher Zeit, redigeret af Klaus Grote, 2:37–52. Oldenburg: Isensee Verlag, 1994.",NA,NA,51 27 28,010 00 32,487
Bettenroder Berg IX,Germany,Niedersachsen,51.457778,10.008889,"Westprofil, Layer 16",20 - 40,30,1,NA,NA,1,NA,1,NA,NA,NA,NA,NA,230,NA,NA,NE,1,Federmessergruppen below,1,NA,1,1,NA,NA,NA,NA,NA,NA,NA,"Grote, Klaus. “Die Buntsandsteinabris im südniedersächsischen Bergland bei Göttingen. Erfassung und Untersuchung ihrer ur- und frühgeschichtlichen Nutzung (1983 - 1987)”. Die Kunde N.F. 39 (1988): 1–43.","Grote, Klaus. “Das Buntsandsteinabri Bettenroder Berg IX im Reinhäuser Wald bei Göttingen - Paläolithikum und Mesolithikum”. Archäologisches Korrespondenzblatt 20 (1990): 137–47.","Grote, Klaus. Die Abris im südlichen Leinebergland bei Göttingen. Archäologische Befunde zum Leben unter Felsschutzdächern in urgeschichtlicher Zeit. Oldenburg: Isensee Verlag, 1994.","Grote, Klaus. “Archäologische Landesaufnahme im Gebiet des Seeburger Sees, Luttersees und ehemaligen Westersees im Untereichsfeld, Ldkr. Göttingen”. Neue Ausgrabungen und Forschungen in Niedersachsen 21 (1999): 13–136.","Ahl, C., og B. Meyer. “Zur bodenkundlich-sedimentologischen Horizontabfolge der Hauptabris im Buntsandsteingebiet von Reinhausen”. I Die Abris im südlichen Leinebergland bei Göttingen. Archäologische Befunde zum Leben unter Felsschutzdächern in urgeschichtlicher Zeit, redigeret af Klaus Grote, 2:37–52. Oldenburg: Isensee Verlag, 1994.",NA,NA,51 27 28,010 00 32,488
Luttersee,Germany,Niedersachsen,51.573611,10.161944,"SW Steinberg, Profil 16",6.5 - 24.5,15.5,1,NA,NA,1,NA,1,NA,1,NA,NA,MLST-C1 or 3,240,NA,NA,NE,1,NA,1,NA,NA,1,NA,NA,1,NA,Yes,Yes,"http://doi.pangaea.de/10.1594/PANGAEA.56808; ""Die Bildungen der Allerödzeit (einschliesslich des Laacher Tuffes) sind nur geringmächtig"" (Beug 1992, p.271)","Firbas, Franz. “THE LATE-GLACIAL VEGETATION OF CENTRAL EUROPE*”. New Phytologist 49, nr. 2 (1950): 163–73. https://doi.org/10.1111/j.1469-8137.1950.tb07502.x.","Frechen, J. “Die Herkunft der spätglazialen Bimstuffe in mittel- und süddeutschen Mooren”. Geologisches Jahrbuch 67 (1952): 209–30.","Chen, S.-H. “Neue Untersuchungen über die spät- und postglaziale Vegetationsgeschichte im Gebiet zwischen Harz und Leine (BRD)”. Flora – Morphologie, Geobotanik, Ökologie 181, nr. 147–177 (1988).","Beug, Hans-Jürgen. “Vegetationsgeschichtliche Untersuchungen über die Besiedlung im Unteren Eichsfeld, Landkreis Göttingen, vom frühen Neolithikum bis zum Mittelalter”. Neue Ausgrabungen und Forschungen in Niedersachsen 20 (1992): 261–339.",NA,NA,NA,51 34 25,010 09 43,489
Hehlen,Germany,Niedersachsen,51.990278000000004,9.488056,NNW wall,75 - 140,107.5,NA,NA,NA,NA,NA,1,NA,NA,NA,NA,NA,240,NA,NA,NE,1,NA,NA,NA,1,1,NA,NA,1,NA,Yes,NA,NA,"Henningsen, Dierck, og W. Thiem. “Pumice ash of the Laacher-See eruption in a Quaternary section near Hehlen (south of Hameln/Weser)”. Neues Jahrbuch für Geologie Und Palaontologie-Abhandlungen 218, nr. 1–2 (oktober 2000): 285–306.",NA,NA,NA,NA,NA,NA,NA,NA,490
Arendsee,Germany,Niedersachsen,52.888049,11.478627,ARS 1,Traces only,NA,NA,NA,NA,NA,NA,NA,NA,NA,NA,NA,NA,NA,23,632,NE,1,Late prehistory/historical material only,NA,NA,NA,1,NA,NA,NA,NA,NA,NA,NA,"Christiansen, Jørg. “Vegetationsgeschichtliche Untersuchungen in der westlichen Prignitz, dem östlichen Hannoverschen Wendland und der nördlichen Altmark”. PhD Thesis, Georg-August-Universität, 2008.",NA,NA,NA,NA,NA,Update 5,NA,NA,491
Gohr,Germany,Nordrhein-Westfalen,51.089507,6.717439,Grube Broich,5,5,NA,NA,NA,NA,NA,NA,NA,NA,NA,NA,NA,NA,NA,NA,NA,NA,NA,NA,NA,1,NA,1,NA,1,NA,NA,NA,NA,"Paas, Wilhelm. “Rezente und fossile Böden auf niederrheinischen Terrassen und deren Deckschichten”. Eiszeitalter & Gegenwart 12 (1962): 165–230. https://doi.org/10.3285/eg.12.1.13.",NA,NA,NA,NA,NA,Update 6,NA,NA,492
Siegburg,Germany,Nordrhein-Westfalen,50.715746,7.170786,Grube Beuel,NA,NA,NA,NA,NA,NA,NA,NA,NA,NA,NA,NA,NA,NA,NA,NA,NA,NA,NA,NA,NA,1,NA,1,NA,NA,NA,NA,NA,NA,"Paas, Wilhelm. “Rezente und fossile Böden auf niederrheinischen Terrassen und deren Deckschichten”. Eiszeitalter & Gegenwart 12 (1962): 165–230. https://doi.org/10.3285/eg.12.1.13.",NA,NA,NA,NA,NA,Update 6,NA,NA,493
Remagen,Germany,Nordrhein-Westfalen,50.575784,7.250383,NA,NA,NA,NA,NA,NA,NA,NA,NA,NA,NA,NA,NA,NA,NA,NA,NA,NA,NA,NA,NA,NA,1,NA,1,NA,NA,NA,NA,NA,NA,"Paas, Wilhelm. “Rezente und fossile Böden auf niederrheinischen Terrassen und deren Deckschichten”. Eiszeitalter & Gegenwart 12 (1962): 165–230. https://doi.org/10.3285/eg.12.1.13.",NA,NA,NA,NA,NA,Update 6,NA,NA,494
Leubsdorf,Germany,Nordrhein-Westfalen,50.545002,7.28726,NA,NA,NA,NA,NA,NA,NA,NA,NA,NA,NA,NA,NA,NA,NA,NA,NA,NA,NA,NA,NA,NA,1,NA,1,NA,NA,NA,NA,NA,NA,"Paas, Wilhelm. “Rezente und fossile Böden auf niederrheinischen Terrassen und deren Deckschichten”. Eiszeitalter & Gegenwart 12 (1962): 165–230. https://doi.org/10.3285/eg.12.1.13.",NA,NA,NA,NA,NA,Update 6,NA,NA,495
Kendel-Hülm,Germany,Nordrhein-Westfalen,51.646795,6.137225,Hülm A4,NA,NA,NA,NA,NA,NA,NA,NA,NA,NA,NA,NA,NA,NA,NA,NA,NA,NA,NA,NA,NA,1,NA,1,NA,NA,NA,NA,NA,NA,"Kasse, C., W. Z. Hoek, S. J. P. Bohncke, M. Konert, J. W. H. Weijers, M. L. Cassee, og R. M. Van der Zee. “Late Glacial fluvial response of the Niers-Rhine (western Germany) to climate and vegetation change”. Journal of Quaternary Science 20, nr. 4 (maj 2005): 377–94.",NA,NA,NA,NA,NA,Update 6,NA,NA,496
Rodderberg,Germany,Nordrhein-Westfalen,50.644506,7.194886,Bohrkern,NA,NA,NA,NA,NA,NA,NA,NA,NA,NA,NA,NA,NA,NA,NA,200,Near-vent,0,NA,NA,1,NA,1,NA,NA,NA,NA,NA,NA,NA,"Blanchard, Henrik. “Neue Erkenntnisse zur Eruptions- und Landschaftsgeschichte des Rodderbergs bei Bonn”. PhD Thesis, Rheinischen Friedrich-Wilhelms-Universität, 2002.",NA,NA,NA,NA,NA,NA,NA,NA,497
Monheim-Hitdorf,Germany,Nordrhein-Westfalen,51.10256,6.940109,NA,Various incalcated layers & lenses,NA,NA,NA,NA,NA,NA,NA,NA,NA,NA,NA,NA,NA,NA,NA,NA,NA,NA,NA,NA,1,NA,1,NA,NA,NA,NA,NA,NA,"Lauer, T., M. Frechen, J. Klostermann, M. Krbetschek, G. Schollmayer, og S. Tsukamoto. “Luminescence Dating of Last Glacial and Early Holocene Fluvial Deposits from the Lower Rhine - Methodological Aspects and Chronological Framework”. Zeitschrift Der Deutschen Gesellschaft Für Geowissenschaften 162, nr. 1 (marts 2011): 47–61. https://doi.org/10.1127/1860-1804/2011/0162-0047.",NA,NA,NA,NA,NA,Update 6,NA,NA,498
Rheinberg,Germany,Nordrhein-Westfalen,51.527105,6.58603,NA,Various incalcated thin (~1cm) lenses,NA,NA,NA,NA,NA,NA,NA,NA,NA,NA,NA,NA,NA,NA,NA,NA,NA,NA,NA,NA,1,NA,1,NA,NA,NA,NA,NA,NA,"Lauer, T., M. Frechen, J. Klostermann, M. Krbetschek, G. Schollmayer, og S. Tsukamoto. “Luminescence Dating of Last Glacial and Early Holocene Fluvial Deposits from the Lower Rhine - Methodological Aspects and Chronological Framework”. Zeitschrift Der Deutschen Gesellschaft Für Geowissenschaften 162, nr. 1 (marts 2011): 47–61. https://doi.org/10.1127/1860-1804/2011/0162-0047.",NA,NA,NA,NA,NA,Update 6,NA,NA,499
Dehner Maar,Germany,Rheinland-Pfalz,50.2923559135,6.50647422573,De3,1,1,NA,NA,NA,NA,NA,NA,NA,NA,NA,NA,NA,60,565,349,W,3,NA,1,NA,NA,1,NA,NA,1,NA,Yes,NA,NA,"Seelos, Klemens, Frank Sirocko, og Stephan Dietrich. “A continuous high-resolution dust record for the reconstruction of wind systems in central Europe (Eifel, Western Germany) over the past 133 ka”. Geophys. Res. Lett. 36, nr. 20 (2009): L20712. https://doi.org/10.1029/2009gl039716.","Dietrich, S., og K. Seelos. “The reconstruction of easterly wind directions for the Eifel region (Central Europe) during the period 40.3-12.9 ka BP”. Climates of the Past 6, nr. 2 (2010): 145–54. https://doi.org/10.5194/cp-6-145-2010.","Dietrich, Stephan, og Frank Sirocko. “The potential for dust detection by means of µXRF scanning in Eifel maar lake sediments”. Eiszeitalter & Gegenwart 60, nr. 1 (2011): 90–104.","Lenaz, D., R. Marciano, D. Veres, S. Dietrich, og F. Sirocko. “Mineralogy of the Dehner and Jungferweiher maar tephras (Eifel, Germany)”. Neues Jahrbuch fur Geologie und Palaontologie - Abhandlungen 257, nr. 1 (2010): 55–67.",NA,NA,Update 7,NA,NA,500
Meerfelder Maar,Germany,Rheinland-Pfalz,50.100556,6.758056,cores 1992 & 1996,7,7,NA,NA,NA,NA,NA,NA,NA,NA,NA,NA,NA,50,NA,NA,Near-vent,0,NA,1,NA,NA,1,NA,NA,NA,NA,NA,Yes,Laminated lake sediments,"Bogaard, Paul van den, og Hans-Ulrich Schmincke. “Laacher See Tephra: A widespread isochronous late Quaternary tephra layer in Central and Northern Europe”. Geological Society of America Bulletin 96, nr. 12 (1985): 1554–71. https://doi.org/10.1130/0016-7606(1985)96<1554:LSTAWI>2.0.CO;2.","Litt, Thomas, Hans-Ulrich Schmincke, og Bernd Kromer. “Environmental response to climatic and volcanic events in central Europe during the Weichselian Lateglacial”. Quaternary Science Reviews 22 (2003): 7–32.","Brauer, A., C. Endres, og J. F. W. Negendank. “Lateglacial calendar year chronology based on annually laminated sediments from Lake Meerfelder Maar, Germany”. Quaternary International 61 (1999): 17–25. https://doi.org/10.1016/S1040-6182(99)00014-2.",NA,NA,NA,NA,50 06 02,006 45 29,501
Holzmaar,Germany,Rheinland-Pfalz,50.119167,6.878333,B/E/F/D/C/P/H/Q/G,9,9,NA,NA,NA,NA,NA,NA,NA,NA,1,NA,NA,40,400,308,Near-vent,0,NA,1,NA,NA,1,NA,NA,NA,NA,NA,NA,NA,"Lotter, A. F., H. J. B. Birks, og B. Zolitschka. “Late-Glacial Pollen and Diatom Changes in Response to 2 Different Environmental Perturbations - Volcanic-Eruption and Younger Dryas Cooling”. Journal of Paleolimnology 14, nr. 1 (juli 1995): 23–47.","Lotter, A. F., og H. J. B. Birks. “The impact of the Laacher See Tephra on terrestrial and aquatic ecosystems in the Black-Forest, southern Germany”. Journal of Quaternary Science 8, nr. 3 (september 1993): 263–76.",NA,NA,NA,NA,NA,NA,NA,502
Buchholz bei Boppard,Germany,Rheinland-Pfalz,50.203056,7.542533,"R 33 95 30, H 55 66 42 (Blatt Nr. 5711 Boppard); W Römerstrasse",15,15,NA,NA,NA,NA,NA,NA,NA,NA,NA,NA,NA,30,390,55-70,Near-vent,0,NA,1,NA,1,1,NA,1,1,NA,NA,NA,NA,"Semmel, A., og R. Petschick. “Spätglaziale Sedimente und ihre äolischen Beimengungen in einigen deutschen Mittelgebirgen”. Geologisches Jahrbuch Hessen 133 (2006): 109–20.",NA,NA,NA,NA,NA,NA,NA,NA,503
Revier Buchholz,Germany,Rheinland-Pfalz,50.208889,7.543889,"Profil 2, Serie Hu XIII, Labor-Nr. 26-36: R 33 94 720, H 55 66 390 (Blatt Nr. 5711 Boppard)",45,45,NA,NA,NA,NA,NA,NA,NA,NA,NA,NA,NA,30,380,50-95,Near-vent,0,NA,1,NA,1,1,NA,NA,NA,NA,Yes,NA,NA,"Stöhr, W. T. “Der Bims (Trachyttuff), seine Verlagerung, Verlehmung und Bodenbildung (Lockerbraunerden) im südwestlichen Rheinischen Schiefergebirge”. Notizblatt des hessischen Landesamts für Bodenforschung 91 (1963): 318–37.",NA,NA,NA,NA,NA,NA,NA,NA,504
Hahnstätten,Germany,Rheinland-Pfalz,50.316944,8.066667,"Steinbruch Schäfer, W-Profil (Blatt 5614 Limburg)",50,50,1,NA,NA,1,NA,1,NA,1,NA,NA,NA,60,175,NA,NE,1,NA,1,NA,1,1,NA,NA,NA,NA,NA,NA,NA,"Semmel, A. “Junge Schuttdecken in hessischen Mittelgebirgen”. Notizblatt des hessischen Landesamts für Bodenforschung 92 (1964): 275–85.","Semmel, Arno. “Der Laacher Bimstuff als Zeitmarke der Landschaftsentwicklung in der Wiesbadener Umgebung”. Jahrbücher des Nassauischen Vereins für Naturkunde 124 (2003): 69–87.",NA,NA,NA,NA,NA,NA,NA,505
Moselbrücke (Treis),Germany,Rheinland-Pfalz,50.176864,7.301973,"Profil 6: SO Moselbrücke in Treis, R 25 93 060, H 55 60 840 (Blatt Nr. 5809 Treis); Baugrube am Hangfuß des Zillerbergs",80,80,NA,NA,NA,NA,NA,NA,NA,NA,NA,NA,NA,30,85,300-380,Near-vent,0,NA,1,NA,1,1,NA,NA,NA,NA,NA,NA,NA,"Stöhr, W. T. “Der Bims (Trachyttuff), seine Verlagerung, Verlehmung und Bodenbildung (Lockerbraunerden) im südwestlichen Rheinischen Schiefergebirge”. Notizblatt des hessischen Landesamts für Bodenforschung 91 (1963): 318–37.",NA,NA,NA,NA,NA,NA,NA,NA,506
Brohltal,Germany,Rheinland-Pfalz,50.454444,7.290833,NA,100,100,NA,NA,NA,NA,NA,NA,NA,NA,NA,1,NA,0,NA,NA,Near-vent,0,NA,1,NA,NA,1,NA,NA,1,NA,NA,NA,NA,"Frechen, J. Der Rheinische Bimsstein. Wittlich: Georg Fischer Verlag, 1953.","Bolus, Michael. Die Siedlungsbefunde des späteiszeitlichen Fundplatzes Niederbieber (Stadt Neuwied): Ausgrabungen 1981-1988; mit Beiträgen von Gabriele Roth, Siegfried Stephan, Rolf C. Rottländ. Monographien (Römisch-Germanisches Zentralmuseum Mainz). Bonn: Rudolf Habelt GmbH, 1992.",NA,NA,NA,NA,NA,NA,NA,507
Niedermendig,Germany,Rheinland-Pfalz,50.3725,7.300556,Tagebau Michels,100,100,NA,NA,NA,NA,NA,NA,NA,NA,NA,1,NA,10,-,NA,Near-vent,0,NA,1,NA,1,1,NA,NA,1,NA,NA,NA,NA,"Frechen, J. Der Rheinische Bimsstein. Wittlich: Georg Fischer Verlag, 1953.",NA,NA,NA,NA,NA,NA,NA,NA,508
Niederbreisig,Germany,Rheinland-Pfalz,50.514722,7.290278,NA,100,100,NA,NA,NA,NA,NA,NA,NA,NA,NA,1,NA,10,-,NA,Near-vent,0,NA,1,NA,1,1,NA,NA,NA,NA,NA,NA,NA,"Frechen, J. Der Rheinische Bimsstein. Wittlich: Georg Fischer Verlag, 1953.",NA,NA,NA,NA,NA,NA,NA,NA,509
Treis an der Mosel,Germany,Rheinland-Pfalz,50.168333,7.301111,NA,100,100,NA,NA,NA,NA,NA,NA,NA,NA,NA,1,NA,30,87,NA,Near-vent,0,NA,1,NA,1,1,NA,NA,NA,NA,NA,NA,NA,"Frechen, J. Der Rheinische Bimsstein. Wittlich: Georg Fischer Verlag, 1953.",NA,NA,NA,NA,NA,NA,NA,NA,510
Schweighausen,Germany,Rheinland-Pfalz,50.279722,7.7475,NA,100,100,NA,NA,NA,NA,NA,NA,NA,NA,NA,1,NA,40,370,NA,Near-vent,0,NA,1,NA,1,1,NA,NA,NA,NA,NA,NA,NA,"Frechen, J. Der Rheinische Bimsstein. Wittlich: Georg Fischer Verlag, 1953.",NA,NA,NA,NA,NA,NA,NA,NA,511
Frankweiler,Germany,Rheinland-Pfalz,50.116667,7.4875,NA,100,100,NA,NA,NA,NA,NA,NA,NA,NA,NA,1,NA,40,-,NA,Near-vent,0,NA,1,NA,1,1,NA,NA,NA,NA,NA,NA,NA,"Frechen, J. Der Rheinische Bimsstein. Wittlich: Georg Fischer Verlag, 1953.",NA,NA,NA,NA,NA,NA,NA,NA,512
Dachskopf,Germany,Rheinland-Pfalz,50.24,7.7175,NA,100,100,NA,NA,NA,NA,NA,NA,NA,NA,NA,1,NA,40,-,NA,Near-vent,0,NA,1,NA,1,1,NA,NA,NA,NA,NA,NA,NA,"Frechen, J. Der Rheinische Bimsstein. Wittlich: Georg Fischer Verlag, 1953.",NA,NA,NA,NA,NA,NA,NA,NA,513
Hachenburg,Germany,Rheinland-Pfalz,50.659167,7.812222,NA,100,100,NA,NA,NA,NA,NA,NA,NA,NA,NA,1,NA,50,-,NA,Near-vent,0,NA,1,NA,1,1,NA,NA,NA,NA,NA,NA,NA,"Frechen, J. Der Rheinische Bimsstein. Wittlich: Georg Fischer Verlag, 1953.",NA,NA,NA,NA,NA,NA,NA,NA,514
Waldesch,Germany,Rheinland-Pfalz,50.285556,7.526944,"Profil 1: R 33 95 120, H 55 72 680 (Blatt Nr. 5711 Boppard)",135,135,NA,NA,NA,NA,NA,NA,NA,NA,NA,NA,NA,20,220,120-255,Near-vent,0,NA,1,NA,1,1,NA,NA,NA,NA,NA,NA,NA,"Stöhr, W. T. “Der Bims (Trachyttuff), seine Verlagerung, Verlehmung und Bodenbildung (Lockerbraunerden) im südwestlichen Rheinischen Schiefergebirge”. Notizblatt des hessischen Landesamts für Bodenforschung 91 (1963): 318–37.",NA,NA,NA,NA,NA,NA,NA,NA,515
Brey,Germany,Rheinland-Pfalz,50.271111,7.623056,Ziegelei Müller (Profil Grubensohle & W-Wand),152,152,NA,NA,NA,1,1,NA,NA,NA,1,NA,NA,30,98,300-452,Near-vent,0,NA,1,NA,NA,1,NA,NA,NA,NA,NA,NA,NA,"Sonne, Volker, og Willy Stöhr. “Bimsvorkommen im Flugsand zwischen Mainz und Ingelheim”. Jahresbericht und Mitteilungen des Oberrheinischen Geologischen Vereins N.F. 41 (1959): 103–16.","Stöhr, W. T. “Der Bims (Trachyttuff), seine Verlagerung, Verlehmung und Bodenbildung (Lockerbraunerden) im südwestlichen Rheinischen Schiefergebirge”. Notizblatt des hessischen Landesamts für Bodenforschung 91 (1963): 318–37.",NA,NA,NA,NA,NA,NA,NA,516
Tönchesberg,Germany,Rheinland-Pfalz,50.367731,7.360936,Tö1/Tö2,200,200,NA,NA,NA,NA,NA,NA,NA,NA,NA,NA,NA,10,250,NA,Near-vent,0,Middle Palaeolithic only,1,NA,1,1,NA,NA,NA,NA,NA,NA,NA,"Conard, Nicholas J. Tönchesberg and its position in the paleolithic prehistory of Northern Europe. Monographien des Römisch-Germanisches Zentralmuseum, Forschungsinstitut für Vor- und Frühgeschichte, Band 20. Bonn: Habelt, 1992.",NA,NA,NA,NA,NA,NA,NA,NA,517
Torney,Germany,Rheinland-Pfalz,50.460833,7.488056,NA,200,200,NA,NA,NA,NA,NA,NA,NA,NA,NA,1,NA,20,NA,NA,Near-vent,0,NA,1,NA,NA,1,NA,NA,NA,NA,NA,NA,NA,"Bolus, Michael. Die Siedlungsbefunde des späteiszeitlichen Fundplatzes Niederbieber (Stadt Neuwied): Ausgrabungen 1981-1988; mit Beiträgen von Gabriele Roth, Siegfried Stephan, Rolf C. Rottländ. Monographien (Römisch-Germanisches Zentralmuseum Mainz). Bonn: Rudolf Habelt GmbH, 1992.",NA,NA,NA,NA,NA,NA,NA,NA,518
Geilen,Germany,Rheinland-Pfalz,50.380336,7.274469,"GEI-1, GEI-3, GEI-4, GEI-5",240,240,1,NA,NA,NA,NA,NA,NA,NA,NA,NA,NA,10,NA,NA,Near-vent,0,NA,1,NA,NA,1,NA,NA,NA,NA,NA,NA,NA,"Preusser, Frank, Daniel Rufer, og Guido Schreurs. “Direct dating of Quaternary phreatic maar eruptions by luminescence methods”. Geology 39, nr. 12 (december 2011): 1135–38. https://doi.org/10.1130/g32345.1.",NA,NA,NA,NA,NA,Update 7,NA,NA,519
Fraukirch,Germany,Rheinland-Pfalz,50.354444,7.313611,NA,300,300,NA,NA,NA,NA,NA,NA,NA,NA,NA,NA,NA,10,NA,NA,Near-vent,0,NA,1,NA,NA,1,NA,NA,NA,NA,NA,NA,NA,"Baales, Michael, Felix Bittmann, og Bernd Kromer. “Verkohlte Bäume im Trass der Laacher See-Tephra bei Kruft (Neuwieder Becken). Ein Beitrag zur Datierung des Laacher See-Ereignisses und zur Vegetation der Alleröd-Zeit am Mittelrhein”. Archäologisches Korrespondenzblatt 28 (1999): 191–204.","Bittmann, Felix. “Reconstruction of the Allerød vegetation of the Neuwied Basin, western Germany, and its surroundings at 12,900 cal b.p”. Vegetation History and Archaeobotany 16, nr. 2 (2007): 139–56.",NA,NA,NA,NA,NA,NA,NA,520
Thür,Germany,Rheinland-Pfalz,50.358333,7.278056,NA,300,300,NA,NA,NA,NA,NA,NA,NA,NA,NA,1,NA,10,200,NA,Near-vent,0,Woodland with traces of human occupation,1,NA,NA,1,NA,NA,NA,NA,NA,NA,NA,"Bolus, Michael. Die Siedlungsbefunde des späteiszeitlichen Fundplatzes Niederbieber (Stadt Neuwied): Ausgrabungen 1981-1988; mit Beiträgen von Gabriele Roth, Siegfried Stephan, Rolf C. Rottländ. Monographien (Römisch-Germanisches Zentralmuseum Mainz). Bonn: Rudolf Habelt GmbH, 1992.",NA,NA,NA,NA,NA,NA,NA,NA,521
